{
  "schemaVersion": "course-materials/v1",
  "course": {
    "code": "PHY301",
    "slug": "phy301",
    "route": "/phy301/",
    "nameZh": "热力学与统计物理",
    "nameEn": "Thermodynamics and Statistical Physics"
  },
  "generatedAt": "2026-10-14T02:56:31.163Z",
  "inventoryStatus": "verified-current-upload",
  "inventoryNote": "已逐文件核验当前静态交付包：10 份英文原始课件与 7 份老师作业/答案/考试材料均和本地收到的老师原件 SHA-256 一致；另登记课程计划原图与 2 份本地开放参考讲义。中英逐页精讲版和网页讲解只计为衍生物，不重复计入原件。该状态只证明当前项目已收录文件，不代表老师平台今后不会新增或替换资料。",
  "summary": {
    "sourceFiles": 20,
    "publishedOriginals": 20,
    "totalPages": 1063,
    "categoryCounts": {
      "assignment": 3,
      "exam": 1,
      "lecture": 10,
      "reference": 2,
      "solution": 3,
      "syllabus": 1
    }
  },
  "materials": [
    {
      "id": "phy301-lecture-01",
      "title": "Lecture 1 — 课程要求、热力学回顾、动理学与 Maxwell-Boltzmann 分布",
      "originalFileName": "PHY301 - 1.pptx",
      "category": "lecture",
      "format": "pptx",
      "sequence": "L1 · Week 1",
      "pages": 25,
      "bytes": 17604973,
      "sha256": "48f76c5dd8157a3eb5a8bb573b86802cbfecddf93ed955f3d8e60f71fc9eec74",
      "sourceStatus": "published-original",
      "originalUrl": "/phy301/materials/lecture-01.pptx",
      "derivativeCount": 2,
      "derivativeLabels": [
        "中英逐页精讲 PPTX（lecture-01_中英逐页精讲.pptx）",
        "站内逐页公式索引、推导与中文讲解"
      ],
      "note": "课程要求、热力学回顾、动理学与 Maxwell-Boltzmann 分布；公开副本已与老师原始 PPTX 做 SHA-256 一致性核验。"
    },
    {
      "id": "phy301-lecture-02",
      "title": "Lecture 2 — 相空间、系综、Liouville 定理、时间反演与遍历性",
      "originalFileName": "PHY301 - 2.pptx",
      "category": "lecture",
      "format": "pptx",
      "sequence": "L2 · Week 2",
      "pages": 16,
      "bytes": 5796093,
      "sha256": "767ab2d5dfc23ed9c2e71554acd1b079f1b8668dd024f6fe73bc90eaea517ee9",
      "sourceStatus": "published-original",
      "originalUrl": "/phy301/materials/lecture-02.pptx",
      "derivativeCount": 2,
      "derivativeLabels": [
        "中英逐页精讲 PPTX（lecture-02_中英逐页精讲.pptx）",
        "站内逐页公式索引、推导与中文讲解"
      ],
      "note": "相空间、系综、Liouville 定理、时间反演与遍历性；公开副本已与老师原始 PPTX 做 SHA-256 一致性核验。"
    },
    {
      "id": "phy301-lecture-03",
      "title": "Lecture 3 — 微正则、正则与巨正则系综，热力学定律及理想气体",
      "originalFileName": "PHY301 - 3.pptx",
      "category": "lecture",
      "format": "pptx",
      "sequence": "L3 · Week 3–4",
      "pages": 27,
      "bytes": 12448548,
      "sha256": "aed04b1c37cb6e93ea2be5ed1a2776f821c6909a1e2f305023f24467e5bd8cbe",
      "sourceStatus": "published-original",
      "originalUrl": "/phy301/materials/lecture-03.pptx",
      "derivativeCount": 2,
      "derivativeLabels": [
        "中英逐页精讲 PPTX（lecture-03_中英逐页精讲.pptx）",
        "站内逐页公式索引、推导与中文讲解"
      ],
      "note": "微正则、正则与巨正则系综，热力学定律及理想气体；公开副本已与老师原始 PPTX 做 SHA-256 一致性核验。"
    },
    {
      "id": "phy301-lecture-04",
      "title": "Lecture 4 — 正则与巨正则系综、两能级系统、理想气体与能量均分",
      "originalFileName": "PHY301 - 4.pptx",
      "category": "lecture",
      "format": "pptx",
      "sequence": "L4 · Week 5",
      "pages": 13,
      "bytes": 15536651,
      "sha256": "a979667e28995ce5c5b75cfc7cd068ec5d676f90465584fdb93947611c3b209b",
      "sourceStatus": "published-original",
      "originalUrl": "/phy301/materials/lecture-04.pptx",
      "derivativeCount": 2,
      "derivativeLabels": [
        "中英逐页精讲 PPTX（lecture-04_中英逐页精讲.pptx）",
        "站内逐页公式索引、推导与中文讲解"
      ],
      "note": "正则与巨正则系综、两能级系统、理想气体与能量均分；公开副本已与老师原始 PPTX 做 SHA-256 一致性核验。"
    },
    {
      "id": "phy301-lecture-05",
      "title": "Lecture 5 — 正则系综续篇与巨正则系综",
      "originalFileName": "PHY301 - 5.pptx",
      "category": "lecture",
      "format": "pptx",
      "sequence": "L5 · Week 5–6",
      "pages": 13,
      "bytes": 18550700,
      "sha256": "e9f8092ee44ac72d7fb6672cc5922a5650e96a7df3041f81e9454b05f7907c70",
      "sourceStatus": "published-original",
      "originalUrl": "/phy301/materials/lecture-05.pptx",
      "derivativeCount": 2,
      "derivativeLabels": [
        "中英逐页精讲 PPTX（lecture-05_中英逐页精讲.pptx）",
        "站内逐页公式索引、推导与中文讲解"
      ],
      "note": "正则系综续篇与巨正则系综；公开副本已与老师原始 PPTX 做 SHA-256 一致性核验。"
    },
    {
      "id": "phy301-lecture-06",
      "title": "Lecture 6 — 相互作用、van der Waals、Ising、Landau 与相变",
      "originalFileName": "PHY301 - 6.pptx",
      "category": "lecture",
      "format": "pptx",
      "sequence": "L6 · Week 7",
      "pages": 29,
      "bytes": 11085219,
      "sha256": "490e9cbc19822557688bb321b253000f719efb43e62cde6320e81cbc3e75f451",
      "sourceStatus": "published-original",
      "originalUrl": "/phy301/materials/lecture-06.pptx",
      "derivativeCount": 2,
      "derivativeLabels": [
        "中英逐页精讲 PPTX（lecture-06_中英逐页精讲.pptx）",
        "站内逐页公式索引、推导与中文讲解"
      ],
      "note": "相互作用、van der Waals、Ising、Landau 与相变；公开副本已与老师原始 PPTX 做 SHA-256 一致性核验。"
    },
    {
      "id": "phy301-lecture-07",
      "title": "Lecture 7 — 经典统计总结、量子形式、密度矩阵与量子系综",
      "originalFileName": "PHY301 - 7.pptx",
      "category": "lecture",
      "format": "pptx",
      "sequence": "L7 · Week 8–9",
      "pages": 19,
      "bytes": 10814359,
      "sha256": "d8704cb3a52e09a9788bedd9250e26fbab4393f8dd7402724c66fbed578ef2f1",
      "sourceStatus": "published-original",
      "originalUrl": "/phy301/materials/lecture-07.pptx",
      "derivativeCount": 2,
      "derivativeLabels": [
        "中英逐页精讲 PPTX（lecture-07_中英逐页精讲.pptx）",
        "站内逐页公式索引、推导与中文讲解"
      ],
      "note": "经典统计总结、量子形式、密度矩阵与量子系综；公开副本已与老师原始 PPTX 做 SHA-256 一致性核验。"
    },
    {
      "id": "phy301-lecture-08",
      "title": "Lecture 8 — 全同粒子、Bose-Einstein、Fermi-Dirac 与 Maxwell-Boltzmann 统计",
      "originalFileName": "PHY301 - 8.pptx",
      "category": "lecture",
      "format": "pptx",
      "sequence": "L8 · Week 10",
      "pages": 19,
      "bytes": 2729771,
      "sha256": "1143a2d7b6470d3a2d7729fee7bcaa6fc575388b5cff4040cb09e787adb12a88",
      "sourceStatus": "published-original",
      "originalUrl": "/phy301/materials/lecture-08.pptx",
      "derivativeCount": 2,
      "derivativeLabels": [
        "中英逐页精讲 PPTX（lecture-08_中英逐页精讲.pptx）",
        "站内逐页公式索引、推导与中文讲解"
      ],
      "note": "全同粒子、Bose-Einstein、Fermi-Dirac 与 Maxwell-Boltzmann 统计；公开副本已与老师原始 PPTX 做 SHA-256 一致性核验。"
    },
    {
      "id": "phy301-lecture-09",
      "title": "Lecture 9 — 理想 Bose/Fermi 气体、黑体辐射、声子与 Pauli 顺磁",
      "originalFileName": "PHY301 - 9.pptx",
      "category": "lecture",
      "format": "pptx",
      "sequence": "L9 · Week 11–12",
      "pages": 35,
      "bytes": 5208155,
      "sha256": "e0c34e32da69fd932d4104dd8edd99c105bd77dbae50ead2f0f4c1de05043cf6",
      "sourceStatus": "published-original",
      "originalUrl": "/phy301/materials/lecture-09.pptx",
      "derivativeCount": 2,
      "derivativeLabels": [
        "中英逐页精讲 PPTX（lecture-09_中英逐页精讲.pptx）",
        "站内逐页公式索引、推导与中文讲解"
      ],
      "note": "理想 Bose/Fermi 气体、黑体辐射、声子与 Pauli 顺磁；公开副本已与老师原始 PPTX 做 SHA-256 一致性核验。"
    },
    {
      "id": "phy301-lecture-10",
      "title": "Lecture 10 — 涨落、Brownian 运动、扩散、Langevin 与 Fokker-Planck 方程",
      "originalFileName": "PHY301 - 10.pptx",
      "category": "lecture",
      "format": "pptx",
      "sequence": "L10 · Week 13",
      "pages": 18,
      "bytes": 5433331,
      "sha256": "8bb2aefd12a43bcc4ed31119995c9f615abe88fb254579a82d4c34efc45c64cb",
      "sourceStatus": "published-original",
      "originalUrl": "/phy301/materials/lecture-10.pptx",
      "derivativeCount": 2,
      "derivativeLabels": [
        "中英逐页精讲 PPTX（lecture-10_中英逐页精讲.pptx）",
        "站内逐页公式索引、推导与中文讲解"
      ],
      "note": "涨落、Brownian 运动、扩散、Langevin 与 Fokker-Planck 方程；公开副本已与老师原始 PPTX 做 SHA-256 一致性核验。"
    },
    {
      "id": "phy301-assignment-01",
      "title": "PHY301 Problem Set 1（2025-09）",
      "originalFileName": "PHY301_Statistical_Physics_Problem_set_1__2025_09.pdf",
      "category": "assignment",
      "format": "pdf",
      "sequence": "Problem Set 1 · Week 1-4",
      "pages": 2,
      "bytes": 202462,
      "sha256": "8407745733b539f262fab7e7039d83cb1fef6a4e4bbad7400edd38e583817cca",
      "sourceStatus": "published-original",
      "originalUrl": "/phy301/materials/problem-set-01.pdf",
      "derivativeCount": 1,
      "derivativeLabels": [
        "站内逐题知识映射与解题路线"
      ],
      "note": "老师原始作业；覆盖 Liouville、Maxwell-Boltzmann、微正则气体与振子。"
    },
    {
      "id": "phy301-solution-01",
      "title": "PHY301 Problem Set 1 Solution（2025-09）",
      "originalFileName": "PHY301_Statistical_Physics_Problem_set_1__2025_09_(Solution).pdf",
      "category": "solution",
      "format": "pdf",
      "sequence": "Problem Set 1 solution · Week 1-4",
      "pages": 12,
      "bytes": 306839,
      "sha256": "43745fb5a160b1f96aabc88046a320b2dbdf55a98ca5fbca3cd7dbe926efb2e2",
      "sourceStatus": "published-original",
      "originalUrl": "/phy301/materials/problem-set-01-solution.pdf",
      "derivativeCount": 1,
      "derivativeLabels": [
        "站内答案勘误与推导讲解"
      ],
      "note": "老师原始答案；站内另行标出符号与归一化注意事项。"
    },
    {
      "id": "phy301-assignment-02",
      "title": "PHY301 Problem Set 2（2025-09）",
      "originalFileName": "PHY301_Statistical_Physics_Problem_set_2__2025_09.pdf",
      "category": "assignment",
      "format": "pdf",
      "sequence": "Problem Set 2 · Week 5-7; Q2 revisited in Week 10",
      "pages": 3,
      "bytes": 140740,
      "sha256": "dd3b965f8c180ca5ed1d7f40dd29e47df0e248fc45f05813047c7af8068ab9b1",
      "sourceStatus": "published-original",
      "originalUrl": "/phy301/materials/problem-set-02.pdf",
      "derivativeCount": 1,
      "derivativeLabels": [
        "站内逐题知识映射与解题路线"
      ],
      "note": "老师原始作业；覆盖正则振子、巨正则吸附与 lattice gas/Ising。"
    },
    {
      "id": "phy301-solution-02",
      "title": "PHY301 Problem Set 2 Solution（2025-09）",
      "originalFileName": "PHY301_Statistical_Physics_Problem_set_2__2025_09_.pdf",
      "category": "solution",
      "format": "pdf",
      "sequence": "Problem Set 2 solution · Week 5-7; Q2 revisited in Week 10",